[{"id":"a10285c5-e652-4572-97c3-48ddf9c0cc9c","applicationId":"def57b9b-caca-4549-bec9-6474dee4cce0","prompt":"生成静态个人展示页，展示 Ada Lovelace 与作品","status":"FAILED","repairAttempts":0,"failureCode":"AGENT_MODEL_PROTOCOL_INVALID","createdAt":"1999-12-31T15:00:00Z","updatedAt":"2026-10-05T04:34:25.629835Z"},{"id":"316947b7-bd95-4391-b4f4-1a6b423110fb","applicationId":"eeb96180-9a8d-4476-bc7e-ef2e33a29242","prompt":"生成静态个人展示页，展示 Ada Lovelace 与作品","status":"FAILED","repairAttempts":0,"failureCode":"AGENT_MODEL_PROTOCOL_INVALID","createdAt":"1999-12-31T15:00:00Z","updatedAt":"2026-10-05T04:34:25.926182Z"},{"id":"490ab7a1-2e6e-4666-bb68-1ab5797d81ba","applicationId":"a6813041-feca-4b70-9b2d-ee156bbbcd14","prompt":"生成静态个人展示页，展示 Ada Lovelace 与作品","status":"FAILED","repairAttempts":0,"failureCode":"AGENT_TOOL_NOT_ALLOWED","createdAt":"1999-12-31T15:00:00Z","updatedAt":"2026-10-05T04:34:26.213992Z"},{"id":"3292679e-7c7f-413d-a335-b7e9ec9b4a23","applicationId":"4c799648-4d3b-4105-9f0d-23f18932e71b","prompt":"生成静态个人展示页，展示 Ada Lovelace 与作品","status":"FAILED","repairAttempts":0,"failureCode":"AGENT_MODEL_PROTOCOL_INVALID","createdAt":"1999-12-31T15:00:00Z","updatedAt":"2026-10-05T04:34:26.500468Z"}]
