[
  {
    "id": "2067acf7-9ba1-4cd6-9db2-dfa6785cde8b",
    "applicationId": "2514a6cf-5e10-4372-bf68-c2cb64a568ac",
    "prompt": "生成静态个人展示页，展示 Ada Lovelace 与作品",
    "status": "FAILED",
    "repairAttempts": 0,
    "failureCode": "AGENT_MODEL_PROTOCOL_INVALID",
    "createdAt": "1999-12-31T15:00:00Z",
    "updatedAt": "2026-10-03T10:12:40.435185Z"
  },
  {
    "id": "874ad913-7877-499b-a548-5c076d916557",
    "applicationId": "e20a783b-d50e-4ea7-9815-ff9cbb7c1dc7",
    "prompt": "生成静态个人展示页，展示 Ada Lovelace 与作品",
    "status": "FAILED",
    "repairAttempts": 0,
    "failureCode": "AGENT_TOOL_NOT_ALLOWED",
    "createdAt": "1999-12-31T15:00:00Z",
    "updatedAt": "2026-10-03T10:12:40.728401Z"
  },
  {
    "id": "222beccd-0f15-4baf-8539-63568423e2aa",
    "applicationId": "0c7b7cc1-73f9-435c-94b3-6aba88c856fe",
    "prompt": "生成静态个人展示页，展示 Ada Lovelace 与作品",
    "status": "FAILED",
    "repairAttempts": 0,
    "failureCode": "AGENT_MODEL_PROTOCOL_INVALID",
    "createdAt": "1999-12-31T15:00:00Z",
    "updatedAt": "2026-10-03T10:12:41.020268Z"
  }
]
